{
  "id": "x402://commandlayer.eth/agent-cards/v1.1.0",
  "name": "CommandLayer Agent Cards Registry Descriptor (v1.1.0)",
  "description": "Frozen well-known discovery descriptor for the CommandLayer Agent Cards v1.1.0 release line.",
  "owner": "commandlayer.eth",
  "ens": "commandlayer.eth",
  "version": "1.1.0",
  "contact": "dev@commandlayer.org",
  "networks": [
    "eip155:1"
  ],
  "registry": {
    "manifest": {
      "http": "https://commandlayer.org/agent-cards/meta/manifest.json"
    },
    "commons_agent": {
      "http": "https://commandlayer.org/agent-cards/meta/commons-agent.json"
    },
    "commercial_agent": {
      "http": "https://commandlayer.org/agent-cards/meta/commercial-agent.json"
    }
  },
  "meta": {
    "agent_cards_version": "1.1.0",
    "current_release": "v1.1.0",
    "legacy_release": "v1.0.0",
    "publish_state": "ready-to-pin",
    "license": "Apache-2.0",
    "descriptor_role": "release-snapshot",
    "frozen_release": "v1.1.0"
  }
}
